{
  "id": "trio-debate",
  "description": "Three debaters (Claude Opus, Codex gpt-5.6-sol, opencode DeepSeek V4 Pro) argue for 2 rounds, with up to 1 extra round if the judge asks for one, then a Claude Opus judge decides. Caveat: the judge runs the same harness and model as debater 'opus'. A fresh process and a fresh session give session independence only -- NOT model independence: the judge shares Opus's priors, blind spots and stylistic preferences, so it may systematically favour that debater's plan. This IS the built-in default: heterogeneity across three harnesses is the mechanism the tool exists for. Use rosters/trio.json when you need a judge that is independent at the model level (Codex judges a Claude-vs-DeepSeek debate). Labels are deliberately anonymous ('Participant A/B/C') so no participant, and no judge, learns which model wrote which plan.",
  "rounds": 2,
  "max_extra_rounds": 1,
  "debaters": [
    {
      "id": "opus",
      "label": "Participant A",
      "harness": "claude",
      "model": "claude-opus-5",
      "structured_output": "native",
      "idle_timeout_seconds": 900
    },
    {
      "id": "sol",
      "label": "Participant B",
      "harness": "codex",
      "model": "gpt-5.6-sol",
      "structured_output": "native",
      "idle_timeout_seconds": 900,
      "reasoning_effort": "high"
    },
    {
      "id": "deepseek",
      "label": "Participant C",
      "harness": "opencode",
      "model": "deepseek/deepseek-v4-pro",
      "structured_output": "fenced_json",
      "idle_timeout_seconds": 1200,
      "variant": "high",
      "agent": "kombat-debater",
      "max_reask": 1
    }
  ],
  "judge": {
    "id": "judge",
    "label": "Judge",
    "harness": "claude",
    "model": "claude-opus-5",
    "structured_output": "native",
    "idle_timeout_seconds": 900
  }
}
