{
  "id": "pair",
  "description": "Claude Opus 5 versus Codex gpt-5.6-sol, judged by Opus in a fresh session. TWO HARNESSES, NO OPENCODE -- this is the roster to reach for on a machine with no working opencode at all, since every other preset contains an opencode/DeepSeek slot. A missing opencode agent listing only WARNS now (the listing is flaky, the dispatch is not), so this is about opencode being absent or broken, not about preflight refusing. Both participants enforce their output schema natively, so there is no fenced-JSON extraction path and nothing to re-ask: the most reliable preset, and the closest to upstream's original two-agent lineup. The judge shares a model with debater 'opus', so it is session-independent but not model-independent; the driver warns about that on every run.",
  "rounds": 2,
  "max_extra_rounds": 1,
  "debaters": [
    {
      "id": "opus",
      "label": "Participant A",
      "harness": "claude",
      "model": "claude-opus-5",
      "structured_output": "native",
      "idle_timeout_seconds": 900
    },
    {
      "id": "sol",
      "label": "Participant B",
      "harness": "codex",
      "model": "gpt-5.6-sol",
      "structured_output": "native",
      "idle_timeout_seconds": 900,
      "reasoning_effort": "high"
    }
  ],
  "judge": {
    "id": "judge",
    "label": "Judge",
    "harness": "claude",
    "model": "claude-opus-5",
    "structured_output": "native",
    "idle_timeout_seconds": 900
  }
}
